{
  "schema_version": "rew.pattern-registry.v1",
  "registry_id": "pattern-registry:4f53cda18c2baa0c0354bb5f9a3ecbe5ed12ab4d8e11ba873c2f11161202b945",
  "generated_at": "2026-09-01T10:55:12.889703Z",
  "product": {
    "name": "runtime-evolution-workbench",
    "version": "0.3.0"
  },
  "patterns": []
}
